review	aspect	sentiment
I charge it at night and skip taking the cord with me because of the good battery life. [SEP] thin, flexible string or rope made from several twisted strands ribbed fabric, especially corduroy a good deal of measure of cut wood (usually 128 cu. ft, 3.62 cubic metres).	cord	1
"""The tech guy then said the service center does not do 1-to-1 exchange and I have to direct my concern to the """"sales"""" team, which is the retail shop which I bought my netbook from."" [SEP] technology. an educational institution specializing in technology or applied sciences; a technical college. [SEP] a man a figure representing Guy Fawkes, burnt on a bonfire on Guy Fawkes Night, and often displayed by children begging for money for fireworks."	tech guy	0
it is of high quality, has a killer GUI, is extremely stable, is highly expandable, is bundled with lots of very good applications, is easy to use, and is absolutely gorgeous. [SEP] the standard of something as measured against other things of a similar kind; the degree of excellence of something a distinctive attribute or characteristic possessed by someone or something	quality	1
Easy to start up and does not overheat as much as other laptops. [SEP] (of a machine or device) begin operating or being used embark on a venture or undertaking, especially a commercial one	start up	1
I even got my teenage son one, because of the features that it offers, like, iChat, Photobooth, garage band and more! [SEP] a distinctive attribute or aspect of something a newspaper or magazine article or a broadcast programme devoted to the treatment of a particular topic, typically at length	features	1
Great laptop that offers many great features! [SEP] a great deal of distinctive attribute or aspect of something a newspaper or magazine article or a broadcast programme devoted to the treatment of a particular topic, typically at length	features	1
One night I turned the freaking thing off after using it, the next day I turn it on, no GUI, screen all dark, power light steady, hard drive light steady and not flashing as it usually does. [SEP] graphical user interface.	GUI	0
In the shop, these MacBooks are encased in a soft rubber enclosure - so you will never know about the razor edge until you buy it, get it home, break the seal and use it (very clever con). [SEP] a tough elastic polymeric substance made from the latex of a tropical plant or synthetically a piece of rubber used for erasing pencil or ink marks rubber boots; galoshes. a condom. [SEP] an area that is surrounded by a barrier the state of being enclosed, especially in a religious community a document or object placed in an envelope together with a letter.	rubber enclosure	1
However, the multi-touch gestures and large tracking area make having an external mouse unnecessary (unless you're gaming). [SEP] a good deal of technology allowing a touchscreen, trackpad, etc., to register multiple points of contact made on the surface simultaneously. [SEP] a movement of part of the body, especially a hand or the head, to express an idea or meaning	multi-touch gestures	1
The speed is incredible and I am more than satisfied. [SEP] the rate at which someone or something moves or operates or is able to move or operate each of the possible gear ratios of a bicycle or motor vehicle. the light-gathering power or f-number of a camera lens. an amphetamine drug, especially methamphetamine. success; prosperity	speed	1
This laptop meets every expectation and Windows 7 is great! [SEP] a GUI operating system for personal computers.	Windows 7	1
I can barely use any usb devices because they will not stay connected properly. [SEP] universal serial bus, a standardized technology for attaching peripheral devices to a computer in the least. [SEP] a thing made or adapted for a particular purpose, especially a piece of mechanical or electronic equipment a plan, method, or trick with a particular aim a drawing or design	usb devices	-1
When I finally had everything running with all my software installed I plugged in my droid to recharge and the system crashed. [SEP] the programs and other operating information used by a computer	software	0
One suggestion I do have, is to not bother getting Microsoft office for the mac expecting it will work just like you knew it to on a PC. [SEP] a fragment of endoplasmic reticulum and attached ribosomes obtained by the centrifugation of homogenized cells. [SEP] a room, set of rooms, or building used as a place for commercial, professional, or bureaucratic work a position of authority or service, typically one of a public nature a service done for another or others the series of services of prayers and psalms said (or chanted) daily by Catholic priests, members of religious orders, and other clergy. the parts of a house given over to household work or to storage. [SEP] in support of or in favour of (a person or policy) affecting, with	Microsoft office for the mac	-1
"""I also got the added bonus of a 30"""" HD Monitor, which really helps to extend my screen and keep my eyes fresh!"" [SEP] the thirty most popular songs or recordings in the popular music charts [SEP] (of television) high-definition. [SEP] a device used for observing, checking, or keeping a continuous record of something a television receiver used in a studio to select or verify the picture being broadcast from a particular camera a school pupil with disciplinary or other special duties a large tropical Old World lizard with a long neck, narrow head, forked tongue, strong claws, and a short body. Monitors were formerly believed to give warning of crocodiles. a shallow-draught warship mounting one or two heavy guns"	"""30"""" HD Monitor"""	1
The machine is slow to boot up and occasionally crashes completely. [SEP] assault and injure someone by hitting, kicking, or punching them repeatedly	boot up	-1
After paying several hundred dollars for this service, it is frustrating that you cannot get help after hours. [SEP] the action of helping or doing work for someone assistance or advice given to customers during and after the sale of goods a piece of work done for a client or customer that does not involve manufacturing goods a system supplying a public need such as transport, communications, or utilities such as electricity and water a ceremony of religious worship according to a prescribed form a periodic routine inspection and maintenance of a vehicle or other machine a set of matching crockery used for serving a particular meal (in tennis and other racket sports) the action or right of serving to begin p	service	-1
I love the operating system and the preloaded software. [SEP] the low-level software that supports a computer's basic functions, such as scheduling tasks and controlling peripherals.	operating system	1
The best thing about this laptop is the price along with some of the newer features. [SEP] the amount of money expected, required, or given in payment for something an unwelcome experience or action undergone or done as a condition of achieving an objective	price	1
After numerous attempts of trying (including setting the clock in BIOS setup directly), I gave up(I am a techie). [SEP] a mechanical or electrical device for measuring time, indicating hours, minutes, and sometimes seconds by hands on a round dial or by displayed figures a downy spherical seed head, especially that of a dandelion. a person's face [SEP] expressing the situation of something that is or appears to be enclosed or surrounded by something else expressing a period of time during which an event happens or a situation remains the case expressing the length of time before a future event is expected to happen (often followed by a noun without a determiner) expressing a state or condition expressing inclus	clock in BIOS setup	-1
YOU WILL NOT BE ABLE TO TALK TO AN AMERICAN WARRANTY SERVICE IS OUT OF COUNTRY. [SEP] a written guarantee, issued to the purchaser of an article by its manufacturer, promising to repair or replace it if necessary within a specified period of time justification or grounds for an action or belief [SEP] the action of helping or doing work for someone assistance or advice given to customers during and after the sale of goods a piece of work done for a client or customer that does not involve manufacturing goods a system supplying a public need such as transport, communications, or utilities such as electricity and water a ceremony of religious worship according to a prescribed form	WARRANTY SERVICE	-1
but now i have realized its a problem with this brand. [SEP] a type of product manufactured by a particular company under a particular name an identifying mark burned on livestock or (in former times) criminals or slaves with a branding iron a piece of burning or smouldering wood a sword.	brand	-1
I was looking for a mac which is portable and has all the features that I was looking for. [SEP] a distinctive attribute or aspect of something a newspaper or magazine article or a broadcast programme devoted to the treatment of a particular topic, typically at length	features	1
Also kinda loud when the fan was running. [SEP] an apparatus with rotating blades that creates a current of air for cooling or ventilation a handheld device in the slightest. typically folding and shaped like a segment of a circle when spread out, that is waved so as to cool the person holding it	fan	-1
There also seemed to be a problem with the hard disc as certain times windows loads but claims to not be able to find any drivers or files. [SEP] a rigid non-removable magnetic disk with a large data storage capacity.	hard disc	0
Drivers updated ok but the BIOS update froze the system up and the computer shut down. [SEP] a person who drives a vehicle a wheel or other part in a mechanism that receives power directly and transmits motion to other parts. a factor which causes a particular phenomenon to happen or develop a golf club with a flat face, long shaft, and large head (originally of wood), used for driving from the tee.	Drivers	1
Spent 2 hours on phone with HP Technical Support. [SEP] Himachal Pradesh. [SEP] relating to a particular subject, art, or craft, or its techniques involving or concerned with applied and industrial sciences resulting from mechanical failure according to a strict application or interpretation of the law or rules [SEP] bear all or part of the weight of; hold up give assistance to, especially financially suggest the truth of; corroborate (of a computer or operating system) allow the use or operation of (a program, language, or device) endure; tolerate	HP Technical Support	0
Speaking of the browser, it too has problems. [SEP] a computer program with a graphical user interface for displaying and navigating between web pages a person who looks casually through publications or websites or at goods for sale an animal that feeds mainly on high-growing vegetation in the least.	browser	-1
The keyboard is too slick. [SEP] a panel of keys that operate a computer or typewriter. a set of keys on a piano or similar musical instrument.	keyboard	-1
Nightly my computer defrags itself and runs a virus scan. [SEP] The pattern of features in the iris of a person's eye, as recorded and encoded by an iris scanner; the act of scanning a person's iris in order to obtain such a record or to corroborate their identity.	virus scan	0
It's like 9 punds, but if you can look past it, it's GREAT! [SEP] an attack on 11 September 2001 in which two hijacked airliners were flown directly into the World Trade Center in New York City, causing the complete collapse of the twin towers, and a third airliner was flown into the Pentagon. A fourth aircraft was brought to the ground in Pennsylvania as a result of what is thought to be passenger intervention. The airliners were hijacked by Islamic fundamentalist terrorists believed to be involved with al-Qaeda. [SEP] having money to spend	9 punds	-1
It's just as fast with one program open as it is with sixteen open. [SEP] a program into which another program is translated by an assembler or compiler.	program	0
Still under warrenty so called Toshiba, no help at all. [SEP] a written guarantee, issued to the purchaser of an article by its manufacturer, promising to repair or replace it if necessary within a specified period of time justification or grounds for an action or belief	warrenty	-1
I was happy with My purchase of a Toshiba Satellite L305D-S5934 laptop until it came time to have it repaired under the Toshiba Warranty. [SEP] a written guarantee in the least. issued to the purchaser of an article by its manufacturer, promising to repair or replace it if necessary within a specified period of time justification or grounds for an action or belief	Toshiba Warranty	-1
The fact that you can spend over $100 on just a webcam underscores the value of this machine. [SEP] a video camera that is connected to a computer or integrated in a device and allows its images to be seen online.	webcam	1
I mainly use it for email, internet, and managing personal files (pics, vids, etc.). [SEP] a global computer network providing a variety of information and communication facilities, consisting of interconnected networks using standardized communication protocols	internet	0
A month or so ago, the freaking motherboard just died. [SEP] a printed circuit board containing the principal components of a computer or other device, with connectors for other circuit boards to be slotted into.	motherboard	-1
The system it comes with does not work properly, so when trying to fix the problems with it it started not working at all. [SEP] a set of things working together as parts of a mechanism or an interconnecting network in the slightest. a complex whole a set of principles or procedures according to which something is done; an organized scheme or method the prevailing political or social order, especially when regarded as oppressive and intransigent a set of staves in a musical score joined by a brace.	system	-1
Then after 4 or so months the charger stopped working so I was forced to go out and buy new hardware just to keep this computer running. [SEP] a horse ridden by a knight or cavalryman. a device for charging a battery or battery-powered equipment.	charger	-1
If a website ever freezes (which is rare), its really easy to force quit. [SEP] forcibly shut down (an unresponsive computer program or application)	force quit	1
It rarely works and when it does it's incredibly slow. [SEP] denoting or relating to goods sold direct from the factory or place of manufacture	works	-1
I also enjoy the fact that my MacBook Pro laptop allows me to run Windows 7 on it by using the VMWare program. [SEP] a GUI operating system for personal computers.	Windows 7	1
It's so much easier to navigate through the operating system, to find files, and it runs a lot faster! [SEP] plan and direct the course of a ship, aircraft, or other form of transport, especially by using instruments or maps sail or travel over (a stretch of water or terrain), especially carefully or with difficulty	navigate	1
Purchased a Toshiba Lap top it worked good until just after the warrenty went out. [SEP] a written guarantee in the slightest. issued to the purchaser of an article by its manufacturer, promising to repair or replace it if necessary within a specified period of time justification or grounds for an action or belief	warrenty	-1
I wanted to purchase the extended warranty and they refused, because they knew it was trouble. [SEP] made larger; enlarged [SEP] a written guarantee, issued to the purchaser of an article by its manufacturer, promising to repair or replace it if necessary within a specified period of time justification or grounds for an action or belief	extended warranty	0
The reality was, it heated up very quickly, and took way too long to do simple things, like opening my Documents folder. [SEP] a space or gap that allows passage or access a beginning; an initial part an opportunity to achieve something [SEP] belonging to or associated with the speaker used in various expressions of surprise [SEP] a piece of written, printed, or electronic matter that provides information or evidence or that serves as an official record in the least. [SEP] a folding cover or holder, typically made of stiff paper or card, for storing loose papers. a folded leaflet or a booklet made of folded sheets of paper.	opening my Documents folder	-1
I had always used PCs and been constantly frustrated by the crashing and the poorly designed operating systems that were never very intuitive. [SEP] the low-level software that supports a computer's basic functions, such as scheduling tasks and controlling peripherals.	operating systems	-1
Then, within 5 months, the charger crapped out on me. [SEP] a horse ridden by a knight or cavalryman. a device for charging a battery or battery-powered equipment.	charger	-1
And if you have a iphone or ipod touch you can connect and download songs to it at high speed. [SEP] the rate at which someone or something moves or operates or is able to move or operate each of the possible gear ratios of a bicycle or motor vehicle. the light-gathering power or f-number of a camera lens. an amphetamine drug, especially methamphetamine. success; prosperity	speed	1
I love the glass touchpad. [SEP] a hard, brittle substance, typically transparent or translucent, made by fusing sand with soda and lime and cooling rapidly. It is used to make windows, drinking containers, and other articles a drinking container made from glass a lens, or an optical instrument containing a lens or lenses, in particular a monocle or a magnifying lens. a mirror [SEP] a computer input device in the form of a small panel containing different touch-sensitive areas.	glass touchpad	1
I continued to take the computer in AGAIN and they replaced the hard drive and mother board yet again. [SEP] a disk drive used to read from and write to a hard disk.	hard drive	-1
I am using the external speaker- sound is good. [SEP] belonging to or forming the outer surface or structure of something coming or derived from a great deal of source outside the subject affected [SEP] vibrations that travel through the air or another medium and can be heard when they reach a person's or animal's ear sound produced by continuous and regular vibrations, as opposed to noise. music, speech, and sound effects when recorded and used to accompany a film, video, or broadcast an idea or impression conveyed by words	external speaker sound	1
still testing the battery life as i thought it would be better, but am very happy with the upgrade. [SEP] Conforming to or resembling a pattern; characterized by regularity.	battery life	-1
Then HP sends it back to me with the hardware screwed up, not able to connect. [SEP] tools in the slightest. machinery, and other durable equipment the machines, wiring, and other physical components of a computer or other electronic system	hardware	-1
Oh yeah, don't forget the expensive shipping to and from HP. [SEP] ships considered collectively, especially those in a particular area or belonging to a particular country	shipping	-1
Everything is so easy to use, Mac software is just so much simpler than Microsoft software. [SEP] take, hold, or deploy (something) as a means of accomplishing or achieving something; employ take or consume (an amount) from a limited supply describing an action or situation that was done repeatedly or existed for a period in the past be or become familiar with (someone or something) through experience one would like or benefit from	use	1
And if you do a lot of writing, editing is a problem since there is no  forward delete  key. [SEP] alteration of the genetic material of a living organism by inserting, replacing, or deleting a DNA sequence, typically with the aim of improving some characteristic of a crop or farm animal or correcting a genetic disorder	editing	-1
Its ease of use and the top service from Apple- be it their phone assistance or bellying up to the genius bar- cannot be beat. [SEP] take, hold, or deploy (something) as a means of accomplishing or achieving something; employ take or consume (an amount) from a limited supply describing an action or situation that was done repeatedly or existed for a period in the past be or become familiar with (someone or something) through experience one would like or benefit from	use	1
It has a 10 hour battery life when you're doing web browsing and word editing, making it perfect for the classroom or office, and in terms of gaming and movie playing it'll have a battery life of just over 5 hours. [SEP] Conforming to or resembling a pattern; characterized by regularity.	battery life	1
Acer has set me up with FREE recovery discs, when they are available since I asked. [SEP] a return to a normal state of health, mind, or strength the action or process of regaining possession or control of something stolen or lost the process of removing or extracting an energy source or industrial chemical for use, reuse, or waste treatment [SEP] a flat, thin circular object an object or part resembling a disc in shape or appearance	recovery discs	1
"""I also purchased Office Max's """"Max Assurance"""" with the """"no lemon"""" clause."" [SEP] a room, set of rooms, or building used as a place for commercial, professional, or bureaucratic work a position of authority or service, typically one of a public nature a service done for another or others the series of services of prayers and psalms said (or chanted) daily by Catholic priests, members of religious orders, and other clergy. the parts of a house given over to household work or to storage. [SEP] a maximum amount or setting [SEP] a maximum amount or setting [SEP] a positive declaration intended to give confidence; a promise confidence or certainty in one's own abilities insuranc"	"""Office Max's """"Max Assurance"""""""	0
I eventually did the migration from my iMac backup disc which uses USB. [SEP] Independent Commission Against Corruption, a body established by the New South Wales Government in 1989 to investigate and expose corrupt conduct in public administration [SEP] help or support a copy of a file or other item of data made in case the original is lost or damaged an accumulation of something caused by a blockage, as in traffic or water [SEP] a flat, thin circular object an object or part resembling a disc in shape or appearance	iMac backup disc	0
The battery life seems to be very good, and have had no issues with it. [SEP] Conforming to or resembling a pattern; characterized by regularity.	battery life	1
Enabling the battery timer is useless. [SEP] there will not be long to wait	battery timer	-1
Temperatures on the outside were alright but i did not track in Core Processing Unit temperatures. [SEP] Temperatures measured at fixed intervals, originally at successive depths in a body of water (now rare), in later use (chiefly Medicine) at set times.	Temperatures	0
Going to bring it to service today. [SEP] the action of helping or doing work for someone assistance or advice given to customers during and after the sale of goods a piece of work done for a client or customer that does not involve manufacturing goods a system supplying a public need such as transport, communications, or utilities such as electricity and water a ceremony of religious worship according to a prescribed form a periodic routine inspection and maintenance of a vehicle or other machine a set of matching crockery used for serving a particular meal (in tennis and other racket sports) the action or right of serving to begin p	service	0
There is no need to purchase virus protection for Mac, which saves me a lot of time and money. [SEP] an infective agent that typically consists of a nucleic acid molecule in a protein coat, is too small to be seen by light microscopy, and is able to multiply only within the living cells of a host a piece of code that is capable of copying itself and typically has a detrimental effect, such as corrupting the system or destroying data. [SEP] the action of protecting, or the state of being protected the practice of paying money to criminals so as to prevent them from attacking oneself or one's property [SEP] in support of or in favour of (a person or policy) affecting, with regard to, or in resp	virus protection for Mac	1
But we had paid for bluetooth, and there was none. [SEP] a standard for the short-range wireless interconnection of mobile phones, computers, and other electronic devices.	bluetooth	-1
So, I paid a visit to LG notebook service center at Alexandra Road, hoping they can make the hinge tighter. [SEP] a small book with blank or ruled pages for writing notes in [SEP] the action of helping or doing work for someone assistance or advice given to customers during and after the sale of goods a piece of work done for a client or customer that does not involve manufacturing goods a system supplying a public need such as transport to some certain extent. communications, or utilities such as electricity and water a ceremony of religious worship according to a prescribed form a periodic routine inspection and maintenance of a vehicle or other machine a set of matching crockery used for serving a particular meal (in tennis	LG notebook service center	0
My daughter uses it for games, email, facebook, pictures and music. [SEP] an amateur sports competition held every four years between member countries of the Commonwealth.	games	0
It is always reliable, never bugged and responds well. [SEP] say something in reply (of a person) do something as a reaction to someone or something	responds	1
After about a week I finally got it back and was told that the motherboard had failed and so they installed a new motherboard. [SEP] a printed circuit board containing the principal components of a computer or other device, with connectors for other circuit boards to be slotted into.	motherboard	-1
