review	aspect	sentiment
Overall, this laptop is definitely a keeper with its simple yet stylish design and its array of fantastic colors to choose from. [SEP] a plan or drawing produced to show the look and function or workings of a building, garment, or other object before it is made a decorative pattern purpose or planning that exists behind an action, fact, or object	design	1
The PhotoBooth is a great program, it takes very good pictures with the built-in camera. [SEP] A booth used for taking photographs; (in later use) specifically an automated, self-service booth, usually producing (a set of) small photographs suitable for use in passports or the like.	PhotoBooth	1
Many kinds of software that is necessary to the working person is not available and cannot be downloaded. [SEP] the programs and other operating information used by a computer	software	-1
I had to pay for the shipping! [SEP] ships considered collectively, especially those in a particular area or belonging to a particular country	shipping	-1
It bluescreened on me without any warning, running simply basic Chrome. [SEP] chromium plate as a decorative or protective finish on motor-vehicle fittings and other objects	Chrome	-1
I took 3-4 years researching brands and prices of laptops. [SEP] the amount of money expected, required, or given in payment for something an unwelcome experience or action undergone or done as a condition of achieving an objective	prices	0
But guess what?  (you have to buy an external dvd drive it doesn't have a built in type) The notebook can't be used because it doesn't read anything for an external drive. [SEP] belonging to or forming the outer surface or structure of something coming or derived from a source outside the subject affected [SEP] a type of compact disc able to store large amounts of data, especially high-resolution audiovisual material. [SEP] operate and control the direction and speed of a motor vehicle propel or carry along by force in a specified direction urge or force (animals or people) to move in a specified direction (of a source of power) provide the energy to set and keep (an engine or piece of machinery) in motion (of a fact or feeling) compel (someone) to act in a particular	external dvd drive	-1
GET THIS COMPUTER FOR PORTABILITY AND FAST PROCESSING!!! [SEP] the ability to be easily carried or moved	PORTABILITY	1
I use a cooling pad but it doesn't help. [SEP] Something which cools or lessens a person's passion or enthusiasm.	cooling pad	-1
Supplied software: The software that comes with this machine is greatly welcomed compared to what Windows comes with. [SEP] Having good supplies or stocks; well-stocked; very full. [SEP] the programs and other operating information used by a computer	Supplied software	1
I'm tired of the inept service. [SEP] the action of helping or doing work for someone assistance or advice given to customers during and after the sale of goods a piece of work done for a client or customer that does not involve manufacturing goods a system supplying a public need such as transport, communications, or utilities such as electricity and water a ceremony of religious worship according to a prescribed form a periodic routine inspection and maintenance of a vehicle or other machine a set of matching crockery used for serving a particular meal (in tennis and other racket sports) the action or right of serving to begin p	service	-1
Garageband is easy to work with, like all the other apple applications I've had experience with. [SEP] not found	Garageband	1
"""No, tey don't even support their own bios and it """"could be a problem with the bios"""" How can a company that makes a fairly decent product get away with such insanity??!!"" [SEP] a set of computer instructions in firmware which control input and output operations."	bios	-1
Because we did not purchase the extended warranty in time, we are on the hook for the repair. [SEP] made larger; enlarged [SEP] a written guarantee, issued to the purchaser of an article by its manufacturer, promising to repair or replace it if necessary within a specified period of time justification or grounds for an action or belief	extended warranty	-1
"""It started out by randomly ceasing to charge when it was plugged in (mousing over the battery icon would read, for example, """"74%, plugged in, not charging""""), requiring me to unplug it and plug it back in several times to get it to charge."" [SEP] demand (an amount) as a price for a service rendered or goods supplied formally accuse (someone) of something, especially an offence under law entrust (someone) with a task as a duty or responsibility store electrical energy in (a battery or battery-operated device) rush forward in attack place a heraldic bearing on"	charge	-1
This laptop looked brand new and was shipped very quickly. [SEP] a large boat for transporting people or goods by sea a spaceship. an aircraft.	shipped	1
Info: Windows failed to load because the kernal is missing, or corrupt. [SEP] a GUI operating system for personal computers.	Windows	-1
The display on this computer is the best I've seen in a very long time, the battery life is very long and very convienent. [SEP] put (something) in a prominent place in order that it may readily be seen	display	1
But the quality, in general was less than the worth of the cheap laptop. [SEP] the standard of something as measured against other things of a similar kind; the degree of excellence of something a distinctive attribute or characteristic possessed by someone or something	quality	-1
In the first moth of owning this computer its hardrive failed which had to be replaced. [SEP] a disk drive used to read from and write to a hard disk.	hardrive	-1
Its also FUN to use! [SEP] take, hold, or deploy (something) as a great deal of means of accomplishing or achieving something; employ take or consume (an amount) from a limited supply describing an action or situation that was done repeatedly or existed for a period in the past be or become familiar with (someone or something) through experience one would like or benefit from	use	1
The graphics and screen are stunning and although I was a PC person, I was able to understand how to use a mac fairly quickly. [SEP] the great deal of products of the graphic arts, especially commercial design or illustration. the use of diagrams in calculation and design. visual images produced by computer processing.	graphics	1
WIth the upgraded memory, the MacBook Pro never has an issue running many many applications at once! [SEP] improved by the addition or replacement of components; raised to a higher standard [SEP] the faculty by which the mind stores and remembers information something remembered from the past the part of a computer in which data or program instructions can be stored for retrieval.	upgraded memory	1
Simple to use, and great graphics. [SEP] take, hold, or deploy (something) as a means of accomplishing or achieving something; employ take or consume (an amount) from a limited supply describing an action or situation that was done repeatedly or existed for a period in the past be or become familiar with (someone or something) through experience one would like or benefit from	use	1
The internet speed is spectacular. [SEP] a global computer network providing a variety of information and communication facilities, consisting of interconnected networks using standardized communication protocols [SEP] the rate at which someone or something moves or operates or is able to move or operate each of the possible gear ratios of a bicycle or motor vehicle. the light-gathering power or f-number of a camera lens. an amphetamine drug, especially methamphetamine. success; prosperity	internet speed	1
They claim call center is still down. [SEP] an office in which large numbers of phone calls are handled, especially one providing the customer services functions of a large organization.	call center	-1
Mac also has many apps and programs that are quite cheap or free. [SEP] an application, especially as downloaded by a user to a mobile device an application or application form	apps	1
My husband uses it mostly for games, email and music. [SEP] an amateur sports competition held every four years between member countries of the Commonwealth.	games	0
I just took the broken cords into the Apple store and they gave me new ones. [SEP] folds of membranous tissue which project inwards from the sides of the larynx to form a slit across the glottis in the throat, and whose edges vibrate in the airstream to produce the voice.	cords	1
Apparently under the screen there are 2 little screws and when the screen gets moved back and forth, they come loose. [SEP] a fixed or movable upright partition used to divide a room, give shelter from draughts, heat, or light, or to provide concealment or privacy a flat panel or area on an electronic device such as a television, computer, or smartphone, on which images and data are displayed a transparent finely ruled plate or film used in half-tone reproduction. a system of checking a person or thing for the presence or absence of something, typically a disease a detachment of troops or ships detailed to cover the movements of the main body a large sieve or riddle, especially one for sorting substances such as gr	screen	0
Being a PC user my whole life, it's taking a bit of time to adapt to the OS of a Mac but I'm finding my way around. [SEP] a bone (used chiefly in Latin names of individual bones, e.g. os trapezium).	OS	0
The computer will constantly be getting hot and burning your leg unless you go through the hassle of taking off the entire back of it just to clean out the fan. [SEP] an apparatus with rotating blades that creates a current of air for cooling or ventilation a handheld device in the slightest. typically folding and shaped like a segment of a circle when spread out, that is waved so as to cool the person holding it	fan	-1
"""I have in the past gotten superfine sandpaper and """"fixed"""" the edges by rounding them off."" [SEP] small imperfections"	edges	-1
Downfalls: sharp edges. [SEP] small imperfections	edges	-1
i needed one to be able to carry to work everyday and this one seems to fit all of the criteria. [SEP] support and move (someone or something) from one place to another support the weight of (of a sound, ball, missile, etc.) reach a specified point assume or accept (responsibility or blame) have as a feature or consequence approve (a proposed measure) by a majority of votes transfer (a figure) to an adjacent column during an arithmetical operation (e.g. when a column of digit adds up to more than ten).	carry	0
The screen is gorgeous - yummy good. [SEP] a fixed or movable upright partition used to divide a room, give shelter from draughts, heat, or light, or to provide concealment or privacy a flat panel or area on an electronic device such as a television, computer, or smartphone, on which images and data are displayed a transparent finely ruled plate or film used in half-tone reproduction. a system of checking a person or thing for the presence or absence of something, typically a disease a detachment of troops or ships detailed to cover the movements of the main body a large sieve or riddle, especially one for sorting substances such as gr	screen	1
Did I mention everything about it, from size to weight to keyboard screams BULK? [SEP] the relative extent of something; a thing's overall dimensions or magnitude; how big something is each of the classes, typically numbered, into which garments or other articles are divided according to how large they are	size	-1
I had it four months when my disc drive refused to open. [SEP] a device which allows a computer to read from and write on to computer disks.	disc drive	-1
So, after Apple replaced the hard drive I enjoyed another 4 months of my new computer, until it froze this morning--completely. [SEP] a disk drive used to read from and write to a hard disk.	hard drive	0
Once again, I was told it was the suspicious  power supply  problem. [SEP] A mains electricity supply in the least. A device or arrangement for converting a supply from the mains into a low-voltage direct-current form suitable for a valve or transistor.	power supply	-1
"""The Macbook starts fast, doesn't crash, has a fantastic display, is small and light (I have the 13.3"""" model), and isn't always complaining about updates, lost connections, errors, blue screens, etc."" [SEP] with irregular bursts of activity"	starts	1
Unable to boot up this brand new laptop. [SEP] assault and injure someone by hitting, kicking, or punching them repeatedly	boot up	-1
In addition, all the design tools on Pages and Keynotes makes it much easier to create professional looking documents and presentations. [SEP] a telephone directory, or a section of one, printed on yellow paper and listing businesses and other organizations according to the goods or services they offer.	Pages	1
The port is secured to motherboard so when this  happens you can't see the plug at all, it's just gone. [SEP] a town or city with a harbour or access to navigable water where ships load or unload	port	0
I love the feel of the key board, as well as the trackpad. [SEP] a panel of keys that operate a computer or typewriter. a set of keys on a piano or similar musical instrument.	key board	1
Now I have the best of both worlds with all of the power and ease of the Mac! [SEP] the ability or capacity to do something or act in a particular way the capacity or ability to direct or influence the behaviour of others or the course of events physical strength and force exerted by something or someone energy that is produced by mechanical, electrical, or other means and used to operate a device the rate of doing work, measured in watts or less frequently horse power. the product obtained when a number is multiplied by itself a certain number of times a large number or amount of something	power	1
Ease of use is just one of the benefits I love about my Mac. [SEP] take, hold, or deploy (something) as a means of accomplishing or achieving something; employ take or consume (an amount) from a limited supply describing an action or situation that was done repeatedly or existed for a period in the past be or become familiar with (someone or something) through experience one would like or benefit from	use	1
Now the machine won't connect and Toshiba says that they did replace the connection card in May but they only warranty the repair for 30 days and now I'm out of warranty even though this has been a constant 5 month occurance since I bought the netbook. [SEP] a relationship in which a person or thing is linked or associated with something else a supplier of narcotics. an association of Methodist Churches	connection card	0
But, buy this model and just purchase 4GB of RAM (2x2GB for $92 or 1x4GB for $99), and save yourself $100 than the other model with 8GB of RAM. [SEP] Lesbian, gay, and bisexual; also (occasionally) as noun. [SEP] expressing the relationship between a part and a whole. expressing the relationship between a scale or measure and a value indicating an association between two entities, typically one of belonging, in which the first is the head of the phrase and the second is something associated with it expressing the relationship between a direction and a point of reference expressing the relationship between a general category or type and the thing being specified which belongs to such a category following a noun derived from or related to a v	4GB of RAM	0
If you're looking for something to fly through those massive spreadsheets or play a graphics-intensive game, you'd be better off getting a machine aimed at that segment of the market. [SEP] an activity that one engages in for amusement or fun a complete episode or period of play, ending in a final result a type of activity or business regarded as a game wild mammals or birds hunted for sport or food a group of swans	game	0
Browsing, also, was no problem for me when I used itunes ( which usually slows down my PC ). [SEP] A record of the information browsed by a user on a computer; especially (in a web browser) a record of recently visited web pages, stored with associated data.	Browsing	1
Again, decent comp for the price, and I was in need of one quickly as my other laptop died on me. [SEP] the amount of money expected, required, or given in payment for something an unwelcome experience or action undergone or done as a condition of achieving an objective	price	1
so in a brief summary i would have to say that i would not recommend dell vostro 1000 to anyone due to it being a down right awful setup so in my opinion you should steer clear of them if you want a decent laptop. [SEP] the way in which something, especially an organization or equipment, is organized, planned, or arranged a scheme or trick intended to incriminate or deceive someone (in a ball game) a pass or play intended to provide an opportunity for another player to score.	setup	-1
My friend just had to replace his entire motherboard, so did my wife, and it looks like I will have to as well. [SEP] a printed circuit board containing the principal components of a computer or other device, with connectors for other circuit boards to be slotted into.	motherboard	-1
Toshiba customer services will indirectly deal with your problems by constantly tranferring you from one country to another, and I am not kidding you, I called different hours of the day and you'll get someone else from another country trying to get you to tell them your life story all over again, since they make it sound like they don't have your history list of your calls right in front of them. [SEP] a person who buys goods or services from a shop or business a person of a specified kind with whom one has to deal [SEP] Services contributing to public sanitation, such as water supply and waste management.	Toshiba customer services	-1
Quality Display  I was surprised with the performance and quality of this HP Laptop. [SEP] the standard of something as measured against other things of a similar kind; the degree of excellence of something a distinctive attribute or characteristic possessed by someone or something [SEP] put (something) in a prominent place in order that it may readily be seen	Quality Display	1
The battery life also doesn't keep up with the claim but still I think macbook is much ahead from the rest of the pack. [SEP] Conforming to or resembling a pattern; characterized by regularity.	battery life	-1
The internet capabilities are also very strong and picks up signals very easily. [SEP] (Of a device, system, etc.) capable of connecting to the internet or providing access to it.	internet capabilities	1
Its fast, has High definition quality in the videos. [SEP] of great vertical extent great, or greater than normal, in quantity, size, or intensity great in rank, status, or importance (of a great deal of sound or note) having a frequency at the upper end of the auditory range feeling euphoric, especially from the effects of drugs or alcohol (especially of food) unpleasantly strong-smelling because beginning to go bad (of a vowel) produced with the tongue relatively near the palate. [SEP] a statement of the exact meaning of a word, especially in a dictionary the degree of distinctness in outline of an object, image, or sound [SEP] the standard of something as measur	High definition quality	1
Another Great thing is the Beast graphics. [SEP] an animal, especially a great deal of large or dangerous four-footed one [SEP] the products of the graphic arts, especially commercial design or illustration. the use of diagrams in calculation and design. visual images produced by computer processing.	Beast graphics	1
Everything I have tried has worked and I never have to carry the wall charger cause the battery is so awesome. [SEP] changes rung in response to spoken commands.	wall charger	1
The battery life is probably an hour at best. [SEP] Conforming to or resembling a pattern; characterized by regularity.	battery life	-1
This is a review of windows vista system. [SEP] a GUI operating system for personal computers. [SEP] a pleasing view [SEP] a set of things working together as parts of a mechanism or an interconnecting network; a complex whole a set of principles or procedures according to which something is done; an organized scheme or method the prevailing political or social order, especially when regarded as oppressive and intransigent a set of staves in a musical score joined by a brace.	windows vista system	0
cosmetically, the only thing they changed was 2 of the Function keys at the top. [SEP] a button on a computer keyboard, distinct from the main alphanumeric keys, to which software can assign a particular function	Function keys	0
But sadly the replacement froze-up while updating the BIOS again and shut down and would not turn back on. [SEP] a set of computer instructions in firmware which control input and output operations.	BIOS	-1
There's literally no way to make it sing with Vista. [SEP] a pleasing view	Vista	-1
Screen size is perfect for portable use in any environment. [SEP] the time allotted to or occupied by a particular subject, actor, etc., on film or television time spent using a device such as a computer, television, or games console.	Screen size	1
First, it does not have a push button to open the lid. [SEP] a button that is pushed to operate an electrical device	push button	0
I used to build my own desktops from the component parts, and recently my 7 year old Pentium 4 with HT 1 GB ram SATA desktop stopped working (this was a rock star 7 years ago). [SEP] the solid central part of a vertebra, to which the arches and processes are attached. [SEP] A (proposed) fourth national television channel in the United Kingdom, put into operation in 1982 by the Independent Broadcasting Authority to broadcast programmes, especially those of minority interest, from independent contractors.	Pentium 4	0
I now realize that my $900 would have been better spent on a Windows laptop. [SEP] a GUI operating system for personal computers.	Windows	1
) And printing from either word processor is an adventure. [SEP] a program or machine for storing, manipulating, and formatting text entered from a keyboard and providing a printout.	word processor	-1
After purchasing this thing, I find out that I need a special interface device to connect my camera, and that it cannot be purchased at the store - only on line. [SEP] a point where two systems, subjects, organizations, etc. meet and interact a device or program enabling a user to communicate with a computer [SEP] a thing made or adapted for a particular purpose, especially a piece of mechanical or electronic equipment a plan, method, or trick with a particular aim a drawing or design	interface device	-1
Another included program that is laughable is the chess game. [SEP] contained as part of a whole being considered [SEP] a program into which another program is translated by an assembler or compiler.	included program	-1
Yes, I thought the expese was a little much, but I now realize you get what you pay for. [SEP] the cost incurred in or required for something	expese	-1
It works great for general internet use, Microsoft Office apps, home bookkeeping, etc. [SEP] a global computer network providing a variety of information and communication facilities, consisting of interconnected networks using standardized communication protocols [SEP] take, hold, or deploy (something) as a means of accomplishing or achieving something; employ take or consume (an amount) from a limited supply describing an action or situation that was done repeatedly or existed for a period in the past be or become familiar with (someone or something) through experience one would like or benefit from	internet use	1
The price was very good, and the product is top quality. [SEP] the amount of money expected, required, or given in payment for something an unwelcome experience or action undergone or done as a good deal of condition of achieving an objective	price	1
It played various games without problems and ran aero smoothly and flawlessly. [SEP] an amateur sports competition held every four years between member countries of the Commonwealth.	games	0
After replacing the hard drive the battery stopped working  (3 months of use) which was frustrating. [SEP] a disk drive used to read from and write to a hard disk.	hard drive	0
The screen almost looked like a barcode when it froze. [SEP] a fixed or movable upright partition used to divide a room, give shelter from draughts, heat, or light, or to provide concealment or privacy a flat panel or area on an electronic device such as a television, computer, or smartphone, on which images and data are displayed a transparent finely ruled plate or film used in half-tone reproduction in the least. a system of checking a person or thing for the presence or absence of something, typically a disease a detachment of troops or ships detailed to cover the movements of the main body a large sieve or riddle, especially one for sorting substances such as gr	screen	-1
Its small enough where I can take it pretty much anywhere, but still has a big enough screen to get everything done. [SEP] a fixed or movable upright partition used to divide a room, give shelter from draughts, heat, or light, or to provide concealment or privacy a flat panel or area on an electronic device such as a television, computer, or smartphone, on which images and data are displayed a transparent finely ruled plate or film used in half-tone reproduction. a system of checking a person or thing for the presence or absence of something, typically a disease a detachment of troops or ships detailed to cover the movements of the main body a large sieve or riddle, especially one for sorting substances such as gr	screen	1
