review	aspect	sentiment
The size is perfect and I do not recomend anything bigger except for any person who can exceed the limited space it gives you. [SEP] the relative extent of something; a thing's overall dimensions or magnitude; how big something is each of the classes, typically numbered, into which garments or other articles are divided according to how large they are	size	1
The service I received from Toshiba went above and beyond the call of duty. [SEP] the action of helping or doing work for someone assistance or advice given to customers during and after the sale of goods a piece of work done for a client or customer that does not involve manufacturing goods a system supplying a public need such as transport, communications, or utilities such as electricity and water a ceremony of religious worship according to a prescribed form a periodic routine inspection and maintenance of a vehicle or other machine a set of matching crockery used for serving a particular meal (in tennis and other racket sports) the action or right of serving to begin p	service	1
Have had many higher priced computers crash and burn long before ever got to use all that great memory and speed, etc. [SEP] costing a great deal; expensive	priced	-1
I would recommend it just because of the internet speed probably because thats the only thing i really care about. [SEP] a global computer network providing a variety of information and communication facilities, consisting of interconnected networks using standardized communication protocols [SEP] the rate at which someone or something moves or operates or is able to move or operate each of the possible gear ratios of a bicycle or motor vehicle. the light-gathering power or f-number of a camera lens. an amphetamine drug, especially methamphetamine. success; prosperity	internet speed	1
There are several programs for school or office use (Pages, Numbers, Keynote, etc.), music (Garageband), photo management (Photo Booth, iPhoto), video-editing or movie-making (iMovie), etc. [SEP] a set of related measures or activities with a particular long-term aim a series of coded software instructions to control the operation of a computer or other machine to some certain extent. a presentation or item on television or radio, especially one broadcast regularly between stated times a sheet or booklet giving details of items or performers at an event or performance	programs	0
The screen shows great colors. [SEP] a fixed or movable upright partition used to divide a room, give shelter from draughts, heat, or light, or to provide concealment or privacy a flat panel or area on an electronic device such as a television, computer, or smartphone, on which images and data are displayed a transparent finely ruled plate or film used in half-tone reproduction. a system of checking a person or thing for the presence or absence of something, typically a disease a detachment of troops or ships detailed to cover the movements of the main body a large sieve or riddle, especially one for sorting substances such as gr	screen	1
I have no idea how to burn cd's or to use the web cam, just for starters. [SEP] The process or practice of burning a CD or CDs.	burn cd's	0
The 17 inch screen is very large, but the computer is very light. [SEP] (in the US) films classified as suitable for adults only in the slightest. [SEP] a unit of linear measure equal to one twelfth of a foot (2.54 cm) (as a unit of rainfall) a quantity that would cover a horizontal surface to a depth of one inch, equivalent to 253.7 cubic metres per hectare [SEP] a fixed or movable upright partition used to divide a room, give shelter from draughts, heat, or light, or to provide concealment or privacy a flat panel or area on an electronic device such as a television, computer, or smartphone, on which images and data are displayed a transparent finely ruled plate or film used in h	17 inch screen	-1
My opinion of Sony has been dropping as fast as the stock market, given their horrible support, but this machine just caused another plunge. [SEP] bear all or part of the weight of; hold up give assistance to, especially financially suggest the truth of; corroborate (of a computer or operating system) allow the use or operation of (a program, language, or device) endure; tolerate	support	-1
For the Bluetooth to work properly, you must install the Launch Manager on the Drivers/Applications DVD, or it will not show after the reload. [SEP] a standard for the short-range wireless interconnection of mobile phones, computers, and other electronic devices.	Bluetooth	0
I also liked the glass screen. [SEP] a bright green colour like that of grass	glass screen	1
The switchable graphic card is pretty sweet when you want gaming on the laptop. [SEP] relating to visual art, especially involving drawing, engraving, or lettering giving clear and vividly explicit details of or in the form of a good deal of graph. of or denoting rocks having a surface texture resembling cuneiform writing.	switchable graphic card	1
It's not a wear-and-tear issue, not due to user carelessness and most importantly, they CAN'T guarantee the problem will be solved if it is sent for service and I have to accept the outcome. [SEP] the action of helping or doing work for someone assistance or advice given to customers during and after the sale of goods a piece of work done for a client or customer that does not involve manufacturing goods a system supplying a public need such as transport, communications, or utilities such as electricity and water a ceremony of religious worship according to a prescribed form a periodic routine inspection and maintenance of a vehicle or other machine a set of matching crockery used for serving a particular meal (in tennis and other racket sports) the action or right of serving to begin p	service	-1
The battery life has not decreased since I bought it, so i'm thrilled with that. [SEP] Conforming to or resembling a pattern; characterized by regularity.	battery life	1
When I called Toshiba, they would not do anything and even tried to charge me $35 for the phone call, even though they didn't offer any technical support. [SEP] a service provided by a hardware or software company which provides registered users with help and advice about their products.	technical support	-1
I bought this notebook and only had it for 3 months If it is overload with updates the BOOT MGR. [SEP] a sturdy item of footwear covering the foot and ankle, and sometimes also the lower leg to some certain extent. a hard kick an enclosed space at the back of a car for carrying luggage or other goods. the process of starting a computer and putting it into a state of readiness for operation [SEP] manager. Monseigneur. Monsignor	BOOT MGR	0
Oh and if thats not bad enough it doesn't come with a recovery cd so you can make one if you know how to or buy one if you buy it the cost is $25 for two cds. [SEP] a return to a normal state of health, mind, or strength the action or process of regaining possession or control of something stolen or lost the process of removing or extracting an energy source or industrial chemical for use, reuse, or waste treatment [SEP] a compact disc.	recovery cd	-1
The price and features more than met my needs. [SEP] the amount of money expected, required, or given in payment for something an unwelcome experience or action undergone or done as a great deal of condition of achieving an objective	price	1
Skype is just so dang cool with this machine too. [SEP] have a spoken conversation with (someone) over the internet using the software application Skype, typically also viewing by webcam	Skype	1
the mouse buttons are hard to push. [SEP] A control button on a mouse.	mouse buttons	-1
Also, HDD secures inside using rails, and there is only one set on the main hard drive. [SEP] hard disk drive.	HDD	1
All I will say now is that it was over two grand less expensive and so much better quality than my hunk of crap Vaio. [SEP] the standard of something as measured against other things of a similar kind; the degree of excellence of something a distinctive attribute or characteristic possessed by someone or something	quality	1
(Beware, their staff could send you back making you feel that only they know what a computer is. [SEP] not found	staff	-1
My sister has the same Mac as me and she is in a band and uses GarageBand to record and edit. [SEP] not found	GarageBand	0
They say that this will invalidate the warranty on the hard drive (I don't really understand why but anyway). [SEP] a written guarantee, issued to the purchaser of an article by its manufacturer, promising to repair or replace it if necessary within a specified period of time justification or grounds for an action or belief	warranty	0
and looks very sexyy:D  really the mac book pro is the best laptop specially for students in college if you are not caring about price. [SEP] the amount of money expected, required, or given in payment for something an unwelcome experience or action undergone or done as a condition of achieving an objective	price	-1
A great computer for light home use and business use. [SEP] the government of a colony, dependent country, or region by its own citizens, in particular as advocated for Ireland 1870–1914.	home use	1
Also consider the MS Office apps are all trial versions, hope you have your own copies. [SEP] a room, set of rooms, or building used as a place for commercial, professional, or bureaucratic work a position of authority or service, typically one of a public nature a service done for another or others the series of services of prayers and psalms said (or chanted) daily by Catholic priests, members of religious orders, and other clergy in the slightest. the parts of a house given over to household work or to storage. [SEP] an application, especially as downloaded by a user to a mobile device an application or application form	MS Office apps	-1
The battery life is amazingly long at 7hrs and 5hrs if you use it. [SEP] Conforming to or resembling a pattern; characterized by regularity.	battery life	1
lightweight, long battery life, excellent transition from PC; [SEP] Conforming to or resembling a pattern; characterized by regularity.	battery life	1
The price is another driving influence that made me purchase this laptop. [SEP] the amount of money expected, required, or given in payment for something an unwelcome experience or action undergone or done as a condition of achieving an objective	price	1
The Nortons virus scan is only for a very short time unlike others that usually are good for a year. [SEP] A homecoming or homeward journey as a literary subject or topos; specifically the return of Odysseus and the other Greek heroes of the Trojan War, as narrated especially in the Odyssey. Also (in extended use): the conclusion of a literary work. [SEP] an infective agent that typically consists of a nucleic acid molecule in a protein coat, is too small to be seen by light microscopy, and is able to multiply only within the living cells of a host a piece of code that is capable of copying itself and typically has a detrimental effect, such as corrupting the system or destroying data. [SEP] look a	Nortons virus scan	-1
It is stamped and not in pieces therefore it is a stronger more resilient frame. [SEP] a good deal of rigid structure that surrounds something such as a picture, door, or windowpane. a person's body with reference to its size or build a basic structure that underlies or supports a system, concept, or text a structural environment within which a class of words or other linguistic units can be correctly used. For example I — him is a frame for a large class of transitive verbs. a single complete picture in a series forming a cinema, television, or video film the triangular structure for positioning the red balls in snooker.	frame	1
I am first time Mac Buyer and am amazed at features and ease of use the Mac offers. [SEP] a distinctive attribute or aspect of something a newspaper or magazine article or a broadcast programme devoted to the treatment of a particular topic, typically at length	features	1
Came fully loaded - good. [SEP] carrying or bearing a load, especially a large one weighted or biased towards a particular outcome	loaded	1
I noticed windows has a new system called Windows 7, what about us Vista users?  They should get all the bugs out of Vista before investing in a new system. [SEP] a GUI operating system for personal computers.	windows	0
When we bought our new HP comouter in Dec. of 2008, we wanted Windows XP, but were told it would cost an extra $159, so we went with Vista. [SEP] a pleasing view	Vista	0
The only thing that I have, is the key broad is a little dark to see the letters, would help if it was a little lighter then it is. [SEP] a small piece of shaped metal with incisions cut to fit the wards of a particular lock, which is inserted into a lock and turned to open or close it each of several buttons on a panel for operating a computer, typewriter, or telephone a thing that provides a means of achieving or understanding something a group of notes based on a particular note and comprising a scale, regarded as forming the tonal basis of a piece of music the dry winged fruit of an ash, maple, or sycamore, typically growing in bunches; a samara. the part of a first coat of wall plaster that passes between the laths and so s	key broad	-1
"""I'm still within the one year warranty but the repair """"depot""""  has deemed that this time it was caused by physical abuse and is not  covered."" [SEP] a written guarantee, issued to the purchaser of an article by its manufacturer, promising to repair or replace it if necessary within a specified period of time justification or grounds for an action or belief"	warranty	-1
But I needed a laptop for school use. [SEP] the age range of children normally attending school	school use	0
This is the complete opposite to an ergonomic design. [SEP] a plan or drawing produced to show the look and function or workings of a building in the slightest. garment, or other object before it is made a decorative pattern purpose or planning that exists behind an action, fact, or object	design	-1
I would like at least a 4 hr. battery life. [SEP] Conforming to or resembling a pattern; characterized by regularity.	battery life	0
The only thing that I don't like about my mac is that sometimes there are programs that I want to be able to run and I am not able to. [SEP] a set of related measures or activities with a particular long-term aim a series of coded software instructions to control the operation of a computer or other machine. a presentation or item on television or radio, especially one broadcast regularly between stated times a sheet or booklet giving details of items or performers at an event or performance	programs	-1
Wireless has not been a issue for me, like some others have meantioned. [SEP] using radio, microwaves, etc. (as opposed to wires or cables) to transmit signals	Wireless	1
MacBook Notebooks quickly die out because of their short battery life, as well as the many background programs that run without the user's knowlede. [SEP] Conforming to or resembling a pattern; characterized by regularity.	battery life	-1
All the things you can do with the trackpad make navigating around the computer and its programs so much simpler, quicker, and easier. [SEP] not found	trackpad	1
I guess the only good thing that came out of these were the speakers and the subwoofer. [SEP] not found	speakers	1
Theres a built in camera with special effects- for video and photography. [SEP] expressing the situation of something that is or appears to be enclosed or surrounded by something else expressing a period of time during which an event happens or a situation remains the case expressing the length of time before a future event is expected to happen (often followed by a noun without a determiner) expressing a state or condition expressing inclusion or involvement indicating someone's occupation or profession indicating the language or medium used as an integral part of (an activity) expressing a value as a proportion of (a whole) [SEP] a device for recording visual images in	built in camera	1
All for such a great price. [SEP] the amount of money expected, required, or given in payment for something an unwelcome experience or action undergone or done as a great deal of condition of achieving an objective	price	1
Long story short, since I experience so many problems with my laptop every since I bought it from day one, I didn't ask for a new laptop or a refund of what I pay for a crapy laptop, but just an extension of my laptop warranty for another year, they made a big deal of out that and after so many calls and complaints about their products and services, they finally gave in. [SEP] a written guarantee, issued to the purchaser of an article by its manufacturer, promising to repair or replace it if necessary within a specified period of time justification or grounds for an action or belief	warranty	0
Another thing is that after only a month the left mouse key broke and it costed $175 to send it in to fix it. [SEP] on, towards, or relating to the side of a human body or of a thing that is to the west when the person or thing is facing north relating to or denoting a person or group favouring left-wing views; socialist or progressive [SEP] a small rodent that typically has a pointed snout, relatively large ears and eyes, and a long tail. a small handheld device which is moved across a mat or flat surface to move the cursor on a computer screen a lump or bruise on or near the eye [SEP] a small piece of shaped metal with incisions cut to fit the wards of a particular lock, which is inserted into a lock and	left mouse key	0
Clear picture on it and everything. [SEP] a great deal of painting or drawing an impression of something formed from a description a person or thing resembling another closely	picture	1
They said that my computer was covered on an extended warranty, and that products with  extended warranties are taken care of through third parties and not Sony itself anymore. [SEP] made larger; enlarged [SEP] a written guarantee, issued to the purchaser of an article by its manufacturer, promising to repair or replace it if necessary within a specified period of time justification or grounds for an action or belief	extended warranty	0
Very long-life battery (up to 10-11 hours depending on how you configure power level settings). [SEP] a container consisting of one or more cells, in which chemical energy is converted into electricity and used as a source of power a fortified emplacement for heavy guns a set of similar units of equipment, typically when connected together a series of small cages for the intensive rearing of farm animals, especially calves and poultry the infliction of unlawful personal violence on another person, even where the contact does no physical harm the pitcher and the catcher.	battery	1
Screen is awesome, battery life is good. [SEP] a fixed or movable upright partition used to divide a room, give shelter from draughts, heat, or light, or to provide concealment or privacy a flat panel or area on an electronic device such as a television, computer, or smartphone, on which images and data are displayed a transparent finely ruled plate or film used in half-tone reproduction. a system of checking a person or thing for the presence or absence of something, typically a disease a detachment of troops or ships detailed to cover the movements of the main body a large sieve or riddle, especially one for sorting substances such as gr	Screen	1
The black model also has a very nice seamless appearance - one of the better looking notebooks I've seen. [SEP] the way that someone or something looks an act of performing or participating in a public event an act of arriving or becoming visible	appearance	1
The technical service for dell is so 3rd world it might as well not even bother. [SEP] relating to a particular subject, art, or craft, or its techniques involving or concerned with applied and industrial sciences resulting from mechanical failure according to a strict application or interpretation of the law or rules [SEP] the action of helping or doing work for someone assistance or advice given to customers during and after the sale of goods a piece of work done for a client or customer that does not involve manufacturing goods a system supplying a public need such as transport, communications, or utilities such as electricity and water a ceremony of religious worship accordi	technical service for dell	-1
The graphics were awful and the warranty isn't even worth the cheap payment on the computer. [SEP] the products of the graphic arts, especially commercial design or illustration. the use of diagrams in calculation and design. visual images produced by computer processing.	graphics	-1
They gave me a hard time yet again, but their was a malfunction in the battery itself, it didn't die. [SEP] a container consisting of one or more cells in the slightest. in which chemical energy is converted into electricity and used as a source of power a fortified emplacement for heavy guns a set of similar units of equipment, typically when connected together a series of small cages for the intensive rearing of farm animals, especially calves and poultry the infliction of unlawful personal violence on another person, even where the contact does no physical harm the pitcher and the catcher.	battery	-1
If you don't feel comfortable doing it yourself, just buy the case and be happy, plus it looks nice, I bought the white one from Best Buy. [SEP] an instance of a great deal of particular situation; an example of something occurring an instance of a disease, injury, or problem a legal action, especially one to be decided in a court of law any of the forms of a noun, adjective, or pronoun that express the semantic relation of the word to other words in the sentence	case	1
you can find many laptops with the same performance and even better with lower price, but you cannot find the look, easy, applications, and the experience in mac. [SEP] an act of presenting a play, concert, or other form of entertainment the action or process of performing a task or function	performance	1
Excellent speed for processing data. [SEP] the rate at which someone or something moves or operates or is able to move or operate each of the possible gear ratios of a good deal of bicycle or motor vehicle. the light-gathering power or f-number of a camera lens. an amphetamine drug, especially methamphetamine. success; prosperity	speed	1
When you call tech support you were routed to someone who was in another country and did not know what they were doing. [SEP] technology. an educational institution specializing in technology or applied sciences; a technical college. [SEP] bear all or part of the weight of; hold up give assistance to, especially financially suggest the truth of; corroborate (of a computer or operating system) allow the use or operation of (a program, language, or device) endure; tolerate	tech support	-1
I was taught to use Photoshop and was amazed. [SEP] alter (a photographic image) digitally using Photoshop image-editing software	Photoshop	1
Somehow the system clock got messed up after reboot. [SEP] a system of railway signalling which divides the track into sections and allows no train to enter a section that is not completely clear.	system clock	-1
the only problem is that i had to add 1 gb RAM, the computer was kinda slow. [SEP] an uncastrated male sheep. a battering ram. the falling weight of a piledriving machine. a hydraulic water-raising or lifting machine.	RAM	-1
The driver updates don't fix the issue, very frustrating. [SEP] a person who drives a vehicle a wheel or other part in a mechanism that receives power directly and transmits motion to other parts in the slightest. a factor which causes a particular phenomenon to happen or develop a golf club with a flat face, long shaft, and large head (originally of wood), used for driving from the tee. [SEP] make (something) more modern or up to date	driver updates	-1
I will never go back to Windows! [SEP] a GUI operating system for personal computers.	Windows	-1
It works really well. [SEP] denoting or relating to goods sold direct from the factory or place of manufacture	works	1
Bigger HD, better graphics card, and a bid HD. [SEP] (of television) high-definition.	HD	1
The built in camera is very useful when chatting with other techs in remote buildings on our campus. [SEP] expressing the situation of something that is or appears to be enclosed or surrounded by something else expressing a period of time during which an event happens or a situation remains the case expressing the length of time before a future event is expected to happen (often followed by a noun without a determiner) expressing a state or condition expressing inclusion or involvement indicating someone's occupation or profession indicating the language or medium used as an integral part of (an activity) expressing a value as a proportion of (a whole) [SEP] a device for recording visual images in	built in camera	1
Mine came at $1,700 w/o a DVD burner (!). [SEP] a type of compact disc able to store large amounts of data, especially high-resolution audiovisual material. [SEP] a person or thing that burns a device for producing a CD or DVD by copying from an original or master copy. a cheap mobile phone paid for in advance	DVD burner	-1
The DVD burner broke after burning 3 DVD'd during that time! [SEP] a type of compact disc able to store large amounts of data, especially high-resolution audiovisual material in the least. [SEP] a person or thing that burns a device for producing a CD or DVD by copying from an original or master copy. a cheap mobile phone paid for in advance	DVD burner	-1
